{
  "version": 1,
  "anchor": {
    "mode": "supplied",
    "witness": [
      {
        "nodeId": "lodging",
        "queryTerm": "cancel"
      }
    ]
  },
  "frontierMap": {
    "supports": "F_S",
    "prohibits": "F_O"
  },
  "depth": 1,
  "cardinalityBound": 4,
  "coverageMode": "requirements",
  "requirements": {
    "F_S": [
      "cancel-allowed"
    ],
    "F_O": [
      "cancel-barred"
    ],
    "F_Q": [],
    "F_T": [],
    "F_A": []
  },
  "floors": {
    "F_S": "1",
    "F_O": "1",
    "F_Q": "0",
    "F_T": "0",
    "F_A": "0"
  },
  "profile": "minimum-cover",
  "asOf": "2026-10-10",
  "minAuthority": null,
  "bounds": {
    "maxAnchorNodes": 4,
    "maxClosureNodes": 16,
    "maxClosureEdges": 16,
    "maxFrontierEvidence": 8,
    "maxRequirementsPerFrontier": 4,
    "maxEvidenceBindings": 8,
    "maxCoverVisits": 1000
  },
  "lexical": null
}
